{
  "schema": "usl-domain-profile/v1",
  "id": "urn:usl:rule-weight-evidence:binding-profile",
  "version": "1",
  "closedMeanings": true,
  "meanings": [
    {
      "id": "urn:usl:addon:applies_binding_rule",
      "allowExtraRoles": false,
      "roles": [
        {
          "role": "rule",
          "required": true,
          "types": [
            "urn:usl:addon:BindingRule"
          ],
          "metadata": []
        },
        {
          "role": "target",
          "required": true,
          "types": [
            "urn:usl:addon:BindingTarget"
          ],
          "metadata": []
        },
        {
          "role": "configuration",
          "required": true,
          "types": [
            "urn:usl:addon:BindingConfiguration"
          ],
          "metadata": []
        },
        {
          "role": "consumer",
          "required": true,
          "types": [
            "urn:usl:addon:Program"
          ],
          "metadata": []
        }
      ]
    },
    {
      "id": "urn:usl:rule-weight-evidence:contextual_weight",
      "allowExtraRoles": false,
      "roles": [
        {
          "role": "rule",
          "required": true,
          "types": [
            "urn:usl:rule-weight-evidence:Rule"
          ],
          "metadata": []
        },
        {
          "role": "configuration",
          "required": true,
          "types": [
            "urn:usl:addon:BindingConfiguration"
          ],
          "metadata": []
        },
        {
          "role": "context",
          "required": true,
          "types": [
            "urn:usl:rule-weight-evidence:Context"
          ],
          "metadata": []
        },
        {
          "role": "weight",
          "required": true,
          "types": [
            "urn:usl:rule-weight-evidence:WeightAssignment"
          ],
          "metadata": []
        }
      ]
    },
    {
      "id": "urn:usl:rule-policy:evaluated_policy",
      "allowExtraRoles": false,
      "roles": [
        {
          "role": "configuration",
          "required": true,
          "types": [
            "urn:usl:addon:BindingConfiguration"
          ],
          "metadata": []
        },
        {
          "role": "target",
          "required": true,
          "types": [
            "urn:usl:addon:BindingTarget"
          ],
          "metadata": []
        },
        {
          "role": "consumer",
          "required": true,
          "types": [
            "urn:usl:addon:Program"
          ],
          "metadata": []
        },
        {
          "role": "result",
          "required": true,
          "types": [
            "urn:usl:rule-policy:Evaluation"
          ],
          "metadata": []
        }
      ]
    },
    {
      "id": "urn:usl:rule-weight-evidence:records_evidence",
      "allowExtraRoles": false,
      "roles": [
        {
          "role": "evidence",
          "required": true,
          "types": [
            "urn:usl:rule-weight-evidence:Evidence"
          ],
          "metadata": []
        },
        {
          "role": "evaluation",
          "required": true,
          "types": [
            "urn:usl:rule-weight-evidence:Evaluation"
          ],
          "metadata": []
        },
        {
          "role": "context",
          "required": true,
          "types": [
            "urn:usl:rule-weight-evidence:Context"
          ],
          "metadata": []
        },
        {
          "role": "action",
          "required": true,
          "types": [
            "urn:usl:rule-weight-evidence:Action"
          ],
          "metadata": []
        },
        {
          "role": "outcome",
          "required": true,
          "types": [
            "urn:usl:rule-weight-evidence:Outcome"
          ],
          "metadata": []
        }
      ]
    },
    {
      "id": "urn:usl:rule-weight-evidence:proposed_revision",
      "allowExtraRoles": false,
      "roles": [
        {
          "role": "baseline",
          "required": true,
          "types": [
            "urn:usl:rule-weight-evidence:PolicySnapshot"
          ],
          "metadata": []
        },
        {
          "role": "candidate",
          "required": true,
          "types": [
            "urn:usl:rule-weight-evidence:PolicySnapshot"
          ],
          "metadata": []
        },
        {
          "role": "context",
          "required": true,
          "types": [
            "urn:usl:rule-weight-evidence:Context"
          ],
          "metadata": []
        },
        {
          "role": "evidence",
          "required": true,
          "types": [
            "urn:usl:rule-weight-evidence:Evidence"
          ],
          "metadata": []
        },
        {
          "role": "proposal",
          "required": true,
          "types": [
            "urn:usl:rule-weight-evidence:WeightRevisionProposal"
          ],
          "metadata": []
        }
      ]
    },
    {
      "id": "urn:usl:rule-weight-evidence:candidate_input_to",
      "allowExtraRoles": false,
      "roles": [
        {
          "role": "signal",
          "required": true,
          "types": [
            "urn:usl:rule-weight-evidence:Evidence"
          ],
          "metadata": []
        },
        {
          "role": "wConcept",
          "required": true,
          "types": [
            "urn:usl:rule-weight-evidence:HSWM_W_Concept"
          ],
          "metadata": []
        }
      ]
    },
    {
      "id": "urn:usl:rule-weight-evidence:reviewed_with_learner",
      "allowExtraRoles": false,
      "roles": [
        {
          "role": "proposal",
          "required": true,
          "types": [
            "urn:usl:rule-weight-evidence:WeightRevisionProposal"
          ],
          "metadata": []
        },
        {
          "role": "context",
          "required": true,
          "types": [
            "urn:usl:rule-weight-evidence:Context"
          ],
          "metadata": []
        },
        {
          "role": "dataset",
          "required": true,
          "types": [
            "urn:usl:rule-weight-evidence:LearningDataset"
          ],
          "metadata": []
        },
        {
          "role": "report",
          "required": true,
          "types": [
            "urn:usl:rule-weight-evidence:LearnerReport"
          ],
          "metadata": []
        },
        {
          "role": "replay",
          "required": true,
          "types": [
            "urn:usl:rule-weight-evidence:ReplayObservation"
          ],
          "metadata": []
        },
        {
          "role": "review",
          "required": true,
          "types": [
            "urn:usl:rule-weight-evidence:LearnerReview"
          ],
          "metadata": []
        }
      ]
    },
    {
      "id": "urn:usl:rule-policy:realized_by",
      "allowExtraRoles": false,
      "roles": [
        {
          "role": "task",
          "required": true,
          "types": [
            "urn:usl:status:Task"
          ],
          "metadata": []
        },
        {
          "role": "feature",
          "required": true,
          "types": [
            "urn:usl:status:Feature"
          ],
          "metadata": []
        }
      ]
    },
    {
      "id": "urn:usl:status:informed_by",
      "allowExtraRoles": false,
      "roles": [
        {
          "role": "task",
          "required": true,
          "types": [
            "urn:usl:status:Task"
          ],
          "metadata": []
        },
        {
          "role": "source",
          "required": true,
          "types": [
            "urn:usl:status:ExternalSource"
          ],
          "metadata": []
        }
      ]
    },
    {
      "id": "urn:usl:status:implemented_by",
      "allowExtraRoles": false,
      "roles": [
        {
          "role": "feature",
          "required": true,
          "types": [
            "urn:usl:status:Feature"
          ],
          "metadata": []
        },
        {
          "role": "artifact",
          "required": true,
          "types": [
            "urn:usl:status:Artifact"
          ],
          "metadata": []
        }
      ]
    },
    {
      "id": "urn:usl:status:tested_by",
      "allowExtraRoles": false,
      "roles": [
        {
          "role": "feature",
          "required": true,
          "types": [
            "urn:usl:status:Feature"
          ],
          "metadata": []
        },
        {
          "role": "evidence",
          "required": true,
          "types": [
            "urn:usl:status:TestEvidence"
          ],
          "metadata": []
        }
      ]
    },
    {
      "id": "urn:usl:status:bounded_by",
      "allowExtraRoles": false,
      "roles": [
        {
          "role": "feature",
          "required": true,
          "types": [
            "urn:usl:status:Feature"
          ],
          "metadata": []
        },
        {
          "role": "limitation",
          "required": true,
          "types": [
            "urn:usl:status:Limitation"
          ],
          "metadata": []
        }
      ]
    }
  ]
}
