{
  "schema": "usl-domain-profile/v1",
  "id": "urn:usl:syntax-cli:profile",
  "version": "1",
  "closedMeanings": true,
  "meanings": [
    {
      "id": "urn:usl:syntax-cli:interpreted_as",
      "allowExtraRoles": false,
      "roles": [
        {
          "role": "statement",
          "required": true,
          "types": [
            "urn:usl:syntax-cli:UserStatement"
          ],
          "metadata": []
        },
        {
          "role": "feature",
          "required": true,
          "types": [
            "urn:usl:syntax-cli:ImplementedFeature"
          ],
          "metadata": []
        }
      ]
    },
    {
      "id": "urn:usl:syntax-cli:implemented_by",
      "allowExtraRoles": false,
      "roles": [
        {
          "role": "feature",
          "required": true,
          "types": [
            "urn:usl:syntax-cli:ImplementedFeature"
          ],
          "metadata": []
        },
        {
          "role": "artifact",
          "required": true,
          "types": [
            "urn:usl:syntax-cli:Artifact"
          ],
          "metadata": []
        }
      ]
    },
    {
      "id": "urn:usl:syntax-cli:trace",
      "allowExtraRoles": false,
      "roles": [
        {
          "role": "statement",
          "required": true,
          "types": [
            "urn:usl:syntax-cli:UserStatement"
          ],
          "metadata": []
        },
        {
          "role": "feature",
          "required": true,
          "types": [
            "urn:usl:syntax-cli:ImplementedFeature"
          ],
          "metadata": []
        },
        {
          "role": "artifact",
          "required": true,
          "types": [
            "urn:usl:syntax-cli:Artifact"
          ],
          "metadata": []
        }
      ]
    },
    {
      "id": "urn:usl:syntax-cli:bounded_by",
      "allowExtraRoles": false,
      "roles": [
        {
          "role": "feature",
          "required": true,
          "types": [
            "urn:usl:syntax-cli:ImplementedFeature"
          ],
          "metadata": []
        },
        {
          "role": "limitation",
          "required": true,
          "types": [
            "urn:usl:syntax-cli:Limitation"
          ],
          "metadata": []
        }
      ]
    },
    {
      "id": "urn:usl:syntax-cli:addresses",
      "allowExtraRoles": false,
      "roles": [
        {
          "role": "proposal",
          "required": true,
          "types": [
            "urn:usl:syntax-cli:Proposal"
          ],
          "metadata": []
        },
        {
          "role": "requirement",
          "required": true,
          "types": [
            "urn:usl:syntax-cli:UserStatement"
          ],
          "metadata": []
        }
      ]
    },
    {
      "id": "urn:usl:syntax-cli:depends_on",
      "allowExtraRoles": false,
      "roles": [
        {
          "role": "proposal",
          "required": true,
          "types": [
            "urn:usl:syntax-cli:Proposal"
          ],
          "metadata": []
        },
        {
          "role": "prerequisite",
          "required": true,
          "types": [
            "urn:usl:syntax-cli:Proposal"
          ],
          "metadata": []
        }
      ]
    },
    {
      "id": "urn:usl:syntax-cli:planned_work",
      "allowExtraRoles": false,
      "roles": [
        {
          "role": "task",
          "required": true,
          "types": [
            "urn:usl:syntax-cli:Task"
          ],
          "metadata": []
        },
        {
          "role": "criterion",
          "required": true,
          "types": [
            "urn:usl:syntax-cli:AcceptanceCriterion"
          ],
          "metadata": []
        },
        {
          "role": "requirement",
          "required": true,
          "types": [
            "urn:usl:syntax-cli:UserStatement"
          ],
          "metadata": []
        }
      ]
    },
    {
      "id": "urn:usl:syntax-cli:task_depends_on",
      "allowExtraRoles": false,
      "roles": [
        {
          "role": "task",
          "required": true,
          "types": [
            "urn:usl:syntax-cli:Task"
          ],
          "metadata": []
        },
        {
          "role": "prerequisite",
          "required": true,
          "types": [
            "urn:usl:syntax-cli:Task"
          ],
          "metadata": []
        }
      ]
    },
    {
      "id": "urn:usl:syntax-cli:advances",
      "allowExtraRoles": false,
      "roles": [
        {
          "role": "task",
          "required": true,
          "types": [
            "urn:usl:syntax-cli:Task"
          ],
          "metadata": []
        },
        {
          "role": "proposal",
          "required": true,
          "types": [
            "urn:usl:syntax-cli:Proposal"
          ],
          "metadata": []
        }
      ]
    },
    {
      "id": "urn:usl:syntax-cli:evaluated_by",
      "allowExtraRoles": false,
      "roles": [
        {
          "role": "requirement",
          "required": true,
          "types": [
            "urn:usl:syntax-cli:UserStatement"
          ],
          "metadata": []
        },
        {
          "role": "technique",
          "required": true,
          "types": [
            "urn:usl:syntax-cli:CompressionTechnique"
          ],
          "metadata": []
        },
        {
          "role": "evidence",
          "required": true,
          "types": [
            "urn:usl:syntax-cli:Source"
          ],
          "metadata": []
        }
      ]
    },
    {
      "id": "urn:usl:syntax-cli:measured_by",
      "allowExtraRoles": false,
      "roles": [
        {
          "role": "requirement",
          "required": true,
          "types": [
            "urn:usl:syntax-cli:UserStatement"
          ],
          "metadata": []
        },
        {
          "role": "technique",
          "required": true,
          "types": [
            "urn:usl:syntax-cli:CompressionTechnique"
          ],
          "metadata": []
        },
        {
          "role": "benchmark",
          "required": true,
          "types": [
            "urn:usl:syntax-cli:BenchmarkArtifact"
          ],
          "metadata": []
        }
      ]
    }
  ]
}
